19511,Rental,Active,Claremont & Birchwood,1600,5/18/12,"Beautiful three bedroom, two bath upgraded walkup features  hardwood floors, fully equipped granite/stainless kitchen,central air, equal size bedrooms, ample closet/storage space, in-unit laundry, garage available, decorative fireplace!",3,2,0,1,1,No,yes,n,Hardwood,y,In Unit,Walkup,no,yes,1500,Rogers Park,Available: Now,,,,,,,
19512,Rental,Active,Walton & Maplewood,1500,5/21/12,"Stunning three bedroom, one bath vintage rehab in Ukrainian Village features hardwood floors, central air, separate living and dining rooms, updated kitchen, ceramic tiled bath, cable ready, laundry room, deck, easy street parking!",3,1,0,0,0,Cats OK,no,n,Hardwood,n,In Building,Walkup,no,yes,1200,Ukrainian Village,Available: Now,,,,,,,
19513,Rental,Active,Emerald & 32nd Street,1300,5/21/12,"Awesome Bridgeport two bedroom, one bath, fully upgraded with gorgeous granite/stainless kitchen, built-in microwave, hardwood floors, granite bath, in-unit laundry, ample closet/storage space, 2 minutes to Orange Line, deck, too!",2,1,0,0,0,No,no,y,Hardwood,y,In Unit,Walkup,no,yes,800,Bridgeport,Available: Now,,,,,,,
19514,Rental,Active,Cleaver & Division,1550,5/22/12,"Rehabbed Wicker Park two bedroom, one bath features central air, hardwood floors, updated kitchen with granite counters,upgraded appliances, in-unit laundry, exposed brick, easy street parking, 2 blocks to EL, pet s OK!!",2,1,0,0,0,Cats and Dogs OK,no,n,Hardwood,y,In Unit,Walkup,no,yes,1100,Wicker Park,Available: Now,,,,,,,
19515,Rental,Active,Winchester & Division,1295,5/27/12,"Spacious Wicker Park one bedroom, one bath on a quiet, pretty tree-lined street, updated kitchen and ceramic tile bath, large bedroom, good closet space, hardwood floors, laundry, parking included, and one block from Division & Damen!",1,1,0,0,1,No,no,n,Hardwood,n,In Building,Walkup,no,no,800,Wicker Park,Available: 8/1/2012,,http://www.thehomesteadgroup.com/uploads/photos/19515-A.jpg,http://www.thehomesteadgroup.com/uploads/photos/19515-B.jpg,http://www.thehomesteadgroup.com/uploads/photos/19515-C.jpg,http://www.thehomesteadgroup.com/uploads/photos/19515-D.jpg,http://www.thehomesteadgroup.com/uploads/photos/19515-E.jpg,http://www.thehomesteadgroup.com/uploads/photos/19515-F.jpg
19521,Rental,Active,Southport & Diversey,1875,5/31/12,"Stunning Lakeview two bedroom, one bath features central air, heat included, hardwood floors, fully upgraded granite & stainless kitchen, custom stone bath, hardwood floors, large 12 x 10 deck, garage available. No pets, please. ",2,1,0,1,1,No,no,y,Hardwood,y,In Unit,Walkup,yes,yes,1000,Lakeview,Available: 7/1/2012,,http://www.thehomesteadgroup.com/uploads/photos/19521-A.jpg,http://www.thehomesteadgroup.com/uploads/photos/19521-B.jpg,http://www.thehomesteadgroup.com/uploads/photos/19521-C.jpg,http://www.thehomesteadgroup.com/uploads/photos/19521-D.jpg,http://www.thehomesteadgroup.com/uploads/photos/19521-E.jpg,http://www.thehomesteadgroup.com/uploads/photos/19521-F.jpg
19522,Rental,Active,Southport & Diversey,895,5/31/12,"Affordable Lakeview one bedroom, one bath features A/C, updated kitchen and ceramic tile bath, private laundry, unit is carpeted, patio, convenient to transportation and Southport nightlife. No pets, please. ",1,1,0,0,0,No,no,y,Carpeting,n,In Unit,Walkup,no,yes,800,Lakeview,Available: 7/1/2012,,http://www.thehomesteadgroup.com/uploads/photos/19522-A.jpg,http://www.thehomesteadgroup.com/uploads/photos/19522-B.jpg,http://www.thehomesteadgroup.com/uploads/photos/19522-C.jpg,http://www.thehomesteadgroup.com/uploads/photos/19522-D.jpg,http://www.thehomesteadgroup.com/uploads/photos/19522-E.jpg,http://www.thehomesteadgroup.com/uploads/photos/19522-F.jpg
19523,Rental,Active,Touhy & Clark,850,5/31/12,"Affordable Rogers Park  one bedroom, one bath rehab features central air, hardwood floors, update kitchen and bath, ample closet/storage room, on-site laundry, original decorative fireplace, pets welcome, too! Convenient to shops/cafes!",1,1,0,0,0,Cats and Dogs OK,yes,n,Hardwood,n,In Building,Walkup,no,yes,800,Rogers Park,Available: Now,,http://www.thehomesteadgroup.com/uploads/photos/19523-A.jpg,http://www.thehomesteadgroup.com/uploads/photos/19523-B.jpg,http://www.thehomesteadgroup.com/uploads/photos/19523-C.jpg,http://www.thehomesteadgroup.com/uploads/photos/19523-D.jpg,http://www.thehomesteadgroup.com/uploads/photos/19523-E.jpg,http://www.thehomesteadgroup.com/uploads/photos/19523-F.jpg
19524,Rental,Active,Sheridan & Morse,700,5/31/12,"Spacious rehabbed studio in Rogers Park features new kitchen, hardwood floors, ample closet/storage space, 550 SF, heat included, on-site laundry, convenient to transportation, walk to the Lake, too!  Cats welcome. ",0,1,0,0,0,Cats OK,no,n,Hardwood,n,In Building,Walkup,yes,no,550,Rogers Park,Available: Now,,http://www.thehomesteadgroup.com/uploads/photos/19524-A.jpg,http://www.thehomesteadgroup.com/uploads/photos/19524-B.jpg,http://www.thehomesteadgroup.com/uploads/photos/19524-C.jpg,http://www.thehomesteadgroup.com/uploads/photos/19524-D.jpg,http://www.thehomesteadgroup.com/uploads/photos/19524-E.jpg,http://www.thehomesteadgroup.com/uploads/photos/19524-F.jpg
19525,Rental,Active,Southport & Diversey,3000,5/31/12,"Drop dead gorgeous three bedroom, den, two bath duplex! Fully equipped Chef's granite/stainless kitchen, highly upgraded appliances, hardwood floors, wet bar, custom stone baths, two large decks, two car garage! Truly a must see!",3,2,0,1,1,No,no,y,Hardwood,y,In Unit,Walkup,no,yes,2000,Lakeview,Available: 7/1/2012,,http://www.thehomesteadgroup.com/uploads/photos/19525-A.jpg,http://www.thehomesteadgroup.com/uploads/photos/19525-B.jpg,http://www.thehomesteadgroup.com/uploads/photos/19525-C.jpg,http://www.thehomesteadgroup.com/uploads/photos/19525-D.jpg,http://www.thehomesteadgroup.com/uploads/photos/19525-E.jpg,http://www.thehomesteadgroup.com/uploads/photos/19525-F.jpg
19526,Rental,Active,Touhy & Wolcott,1250,6/1/12,"Fully upgraded two bedroom, two bath in Rogers Park! Unit features fully equipped granite/stainless kitchen, A/C, custom painted, hardwood floors, stone baths, separate dining area, huge bedrooms, ample closet space, parking included!",2,2,0,0,1,Cats and Dogs OK,no,n,Hardwood,y,In Unit,Condo,yes,yes,1000,Rogers Park,Available: 7/1/2012,,http://www.thehomesteadgroup.com/uploads/photos/19526-A.jpg,http://www.thehomesteadgroup.com/uploads/photos/19526-B.jpg,http://www.thehomesteadgroup.com/uploads/photos/19526-C.jpg,http://www.thehomesteadgroup.com/uploads/photos/19526-D.jpg,http://www.thehomesteadgroup.com/uploads/photos/19526-E.jpg,http://www.thehomesteadgroup.com/uploads/photos/19526-F.jpg
19527,Rental,Active,Armitage & Dayton,2800,6/1/12,"Rarely available two bedroom, two bath Lincoln Park condo, fully upgraded! Chef's granite/stainless kitchen, hardwood floors, carpeted bedrooms, master spa suite, custom stone, Jacuzzi, two decks, fireplace, garage included! A must see!",2,2,0,1,1,Cats and Dogs OK,yes,y,Hardwood,y,In Unit,Condo,no,yes,2000,Lincoln Park,Available: 6/15/2012,,http://www.thehomesteadgroup.com/uploads/photos/19527-A.jpg,http://www.thehomesteadgroup.com/uploads/photos/19527-B.jpg,http://www.thehomesteadgroup.com/uploads/photos/19527-C.jpg,http://www.thehomesteadgroup.com/uploads/photos/19527-D.jpg,http://www.thehomesteadgroup.com/uploads/photos/19527-E.jpg,http://www.thehomesteadgroup.com/uploads/photos/19527-F.jpg
