19255,Rental,Active,Arthur & Sheridan Road,1445,12/12/11,"Beautiful Rogers Park one bedroom plus den! Granite kitchen, black appliances, upgraded bathroom, large bedroom, ample closet/storage space, balcony, in-unit laundry, pets OK, convenient to the University and transportation,parking available!",1,1,0,0,1,Cats and Dogs OK,no,y,Hardwood & Carpet,y,In Unit,Mid-rise,no,yes,915,Rogers Park,Available: Now,,,,,,,
19256,Rental,Active,Arthur & Sheridan Road,1315,12/12/11,"Drop dead gorgeous one bed in Rogers Park! Units features central air, new kitchen, granite counters, upgraded appliances, in-unit laundry, balcony, fitness center, rooftop deck with gas grills, parking available!",1,1,0,0,1,Cats and Dogs OK,no,y,Hardwood & Carpet,y,In Unit,Mid-rise,no,yes,770,Rogers Park,Available: Now,,,,,,,
19257,Rental,Active,Arthur & Sheridan Road,1525,12/12/11,"Rogers Park one bedroom plus den! Granite kitchen, black appliances, upgraded bathroom, large bedroom, ample closet/storage space, balcony, in-unit laundry, pets OK, close to the University and transportation, parking available!",1,1,0,0,1,Cats and Dogs OK,no,y,Hardwood & Carpet,y,In Unit,Mid-rise,no,yes,942,Rogers Park,Available: Now,,,,,,,
19258,Rental,Active,Arthur & Sheridan Road,1345,12/12/11,"Drop dead gorgeous convertible in Rogers Park! Units features central air, new kitchen, granite counters, upgraded appliances, in-unit laundry, balcony, fitness center, rooftop deck with gas grills, parking available!",1,1,0,0,1,Cats and Dogs OK,no,y,Hardwood & Carpet,y,In Unit,Mid-rise,no,yes,665,Rogers Park,Available: Now,,,,,,,
19261,Rental,Active,Arthur & Sheridan Road,2350,12/12/11,"Rogers Park two bed, two bath! Granite kitchen, black appliances, upgraded bathroom, large bedroom, ample closet/storage space, balcony, in-unit laundry, pets OK, close to the University and transportation, parking available!",2,2,0,0,1,Cats and Dogs OK,no,y,Hardwood & Carpet,y,In Unit,Mid-rise,no,yes,1165,Rogers Park,Available: Now,,,,,,,
19262,Rental,Active,Arthur & Sheridan Road,2015,12/12/11,"Rogers Park two bed, two bath! Granite kitchen, black appliances, upgraded bathroom, large bedroom, ample closet/storage space, balcony, in-unit laundry, pets OK, close to the University and transportation, parking available!",2,2,0,0,1,Cats and Dogs OK,no,y,Hardwood & Carpet,y,In Unit,Mid-rise,no,yes,1165,Rogers Park,Available: Now,,,,,,,
19263,Rental,Active,Arthur & Sheridan Road,2050,12/12/11,"Amazing, eco-friendly two bed, two bath! Granite kitchen, black appliances, upgraded bathroom, large bedroom, ample closet/storage space, balcony, in-unit laundry, pets OK, close to the University and transportation, parking available!",2,2,0,0,1,Cats and Dogs OK,no,y,Hardwood & Carpet,y,In Unit,Mid-rise,no,yes,1165,Rogers Park,Available: Now,,,,,,,
19264,Rental,Active,Wayman & DesPlaines,4275,12/12/11,"Two bedroom , 2.5 bath luxury duplex penthouse in the West Loop!  Central air/heat included, hardwood floors, fully equipped granite/stainless kitchen, custom stone bathroom, in-unit laundry, balcony, pets welcome, garage available!",2,2,1,1,1,Cats and Dogs OK,no,y,Hardwood,y,In Unit,High-rise,yes,yes,1425,West Loop,Available: Now,,,,,,,
19269,Rental,Active,Wayman & DesPlaines,6090,12/15/11,"Three bedroom, three bath luxury duplex penthouse in the West Loop!  Central air/heat included, hardwood floors, fully equipped granite/stainless kitchen, custom stone bathroom, in-unit laundry, balcony, pets welcome, garage available!",3,3,0,1,1,Cats and Dogs OK,no,y,Hardwood,y,In Unit,High-rise,yes,yes,2000,West Loop,Available: Now,,,,,,,
19270,Rental,Active,Lake Shore Drive & Schiller,2975,12/15/11,"Fully upgraded two bedroom, two bath condo on Lake Shore Drive! Across from Oak St. Beach, crown molding, fully equipped granite kitchen, hardwood floors throughout, stunning lake/skyline views, doorman, pool, fitness center, pkg.",2,2,0,1,1,Cats and Dogs OK,no,n,Hardwood,y,In Building,Condo,no,yes,1300,Gold Coast,Available: Now,,,,,,,
19273,Rental,Active,Chestnut & State,1465,12/15/11,"Gold Coast convertible one bed, one bath with great views on high floor! Heat & A/C included, updated kitchen, dishwasher, ceramic tile baths, walk-in closets, window treatments, pool, Jacuzzi, fitness center, doorman, garage, too!",1,1,0,0,1,Cats OK,no,n,Carpeting,y,In Building,High-rise,yes,yes,700,Gold Coast,Available: Now,,,,,,,
19274,Rental,Active,Chestnut & State,2150,12/15/11,"Beautiful Gold Coast two bedroom, two bath features heat and A/C included, updated kitchen, dishwasher, ceramic tile baths, walk-in closets, window treatments, pool, Jacuzzi, fitness center, doorman, storage, garage, Club Center! ",2,2,0,1,1,Cats OK,no,n,Carpeting,y,In Building,High-rise,yes,yes,1050,Gold Coast,Available: Now,,,,,,,
19276,Rental,Active,Erie & Wells,2635,1/20/12,"River North one bedroom plus den! Granite/stainless kitchens, in-unit laundry, custom stone bath, hardwood floors, doorman, spa, fitness center, club room, business center and too many amenities to list. Garage available!",1,1,0,0,1,Cats and Dogs OK,no,y,Hardwood,y,In Unit,High-rise,yes,yes,938,River North,Available: Now,,,,,,,
19277,Rental,Active,Erie & Wells,4775,2/10/12,"Stunning three bedroom, den two bath penthouse! Granite/stainless kitchen, upgraded stone baths, hardwood floors, in-unit laundry, large, private terrace, doorman, spa, fitness center, club room, business center, garage available!",3,2,0,0,1,Cats and Dogs OK,no,y,Hardwood,y,In Unit,High-rise,yes,yes,1715,River North,Available: Now,,,,,,,
19302,Rental,Active,Artesian & Granville,1200,1/7/12,"Enormous, heat included, three bedroom, one bath in Rogers Park features hardwood floors throughout, central air, beautiful new kitchen, new tile, formal dining room, bay windows, huge living room, laundry hookups, over 2200 SF!",3,1,0,0,0,Cats OK,no,y,Hardwood,n,Hook Ups,Walkup,yes,yes,2200,Rogers Park,Available: Now,,,,,,,
19312,Rental,Active,Elston & Markham,1200,1/17/12,"Affordable three bedroom, one bath features central air, new kitchen, dishwasher, built-in microwave, refinished hardwood floors, on-site laundry, easy street parking, convenient to transportation, too! No pets, please. ",3,1,0,0,0,No,no,n,Hardwood,y,In Building,Walkup,no,yes,1200,Portage Park,Available: Now,,,,,,,
19337,Rental,Active,Beacon & Sunnyside,1450,4/13/12,"Two bedroom, one bath vintage rehab in Sheridan Park features hardwood floors, heat included, updated kitchen, dishwasher, large living/dining rooms, ample closet/storage space, on-site laundry, parking available!",2,1,0,1,1,No,no,n,Hardwood,y,In Building,Walkup,yes,no,1300,Sheridan Park,Available: Now,,,,,,,
19342,Rental,Active,Hazel & Montrose,1195,5/5/12,"Gut rehabbed Uptown spacious studio with fully equipped granite/stainless kitchen, separate living and dining room, walk-in closets, fitness center, outdoor pool, huge sun deck, tennis court, on-site Jewel/Osco, dry cleaners, too! ",0,1,0,0,1,Cats OK,no,y,Carpeting,y,In Building,High-rise,no,yes,600,Uptown,Available: Now,,,,,,,
19349,Rental,Active,Sheridan & Wellington,1075,2/16/12,"East Lakeview one bedroom in a great mid rise features heat/hot water and cooking gas included, new hardwood floors, updated kitchen and bath, ample closet/storage space, spacious living room, dining area , laundry, cats welcome, too!",1,1,0,0,0,Cats OK,no,n,Hardwood,n,In Building,Mid-rise,yes,no,450,Lakeview,Available: Now,,,,,,,
19351,Rental,Active,Winchester & Winnemac,1025,2/8/12,"Beautiful one bedroom, one bath in Ravenswood! Updated kitchen and bath, dishwasher, laundry, deck, heat included, hardwood floors, spacious living/dining rooms, close to EL, walking distance to Lincoln Square shops & nightlife!",1,1,0,0,0,No,no,y,Hardwood,y,In Building,Walkup,yes,yes,850,Ravenswood,Available: Now,,,,,,,
19353,Rental,Active,State & 14th,2305,2/8/12,"Simply awesome South Loop two bedroom, two bath! Polished concrete floors, central air, upgraded kitchen, cherry cabinets, dishwasher, upgraded bath, in-unit laundry, floor to ceiling windows, lake/city views, fitness & business center! ",2,2,0,0,1,Cats and Dogs OK,no,y,Hardwood & Carpet,y,In Unit,High-rise,no,yes,1050,South Loop,Available: Now,,,,,,,
19354,Rental,Active,State & 14th,1695,2/8/12,"Stunning South Loop one bedroom, one bath features polished concrete floors, central air, upgraded kitchen, cherry cabinets, dishwasher, upgraded bath, in-unit laundry, floor to ceiling windows, lake/city views, fitness & business center! ",1,1,0,0,1,Cats and Dogs OK,no,y,Hardwood & Carpet,y,In Unit,High-rise,no,yes,820,South Loop,Available: Now,,,,,,,
19358,Rental,Active,Washington & Wells,2188,2/8/12,"One bed plus den! Granite/stainless/cherry kitchen, custom tile baths, hardwood floors, in-unit laundry, garage available, game room, media room, massage therapy room, fitness center,  pool, deck, business center, library! A must see!",1,1,0,1,1,Cats and Dogs OK,no,n,Hardwood,y,In Unit,High-rise,no,yes,935,Loop,Available: Now,,,,,,,
19359,Rental,Active,Washington & Wells,2175,2/8/12,"One bed plus den! Granite/stainless/cherry kitchen, custom tile baths, hardwood floors, in-unit laundry, garage available, game room, media room, massage therapy room, fitness center,  pool, deck, business center, library! A must see!",1,1,0,1,1,Cats and Dogs OK,no,n,Hardwood,y,In Unit,High-rise,no,yes,935,Loop,Available: Now,,,,,,,
19360,Rental,Active,Washington & Wells,1955,2/8/12,"Green living in the Loop! Granite/stainless/cherry kitchen, custom tile baths, hardwood floors, in-unit laundry, garage available, game room, media room, massage therapy room, fitness center,  pool, deck, business center, library!",1,1,0,1,1,Cats and Dogs OK,no,n,Hardwood,y,In Unit,High-rise,no,yes,770,Loop,Available: Now,,,,,,,
19361,Rental,Active,Washington & Wells,1710,2/8/12,"Junior one bed in the Loop! Granite/stainless/cherry kitchen, custom tile baths, hardwood floors, in-unit laundry, garage available, game room, media room, massage therapy room, fitness center,  pool, deck, business center, library!",1,1,0,1,1,Cats and Dogs OK,no,n,Carpeting,y,In Unit,High-rise,no,yes,700,Loop,Available: Now,,,,,,,
19362,Rental,Active,Washington & Wells,2855,2/8/12,"Two bed, two bath in the Loop! Granite/stainless/cherry kitchen, custom tile baths, hardwood floors, in-unit laundry, garage available, game room, media room, massage therapy room, fitness center,  pool, deck, business center, library! ",2,2,0,1,1,Cats and Dogs OK,no,n,Hardwood,y,In Unit,High-rise,no,yes,1185,Loop,Available: Now,,,,,,,
19377,Rental,Active,Hazel & Montrose,1515,5/5/12,"Drop dead gorgeous one bedroom, one bath midrise!  Convenient to transportation, many amenities including outdoor pool, deck, tennis court, on-site laundry, grocery and bank, new stainless/granite kitchen, Berber carpeting, cats OK!",1,1,0,1,1,Cats OK,no,y,Carpeting,y,In Building,High-rise,no,yes,850,Uptown,Available: Now,,,,,,,
19385,Rental,Active,Dearborn & Division,1850,5/22/12,"Phenomenal Gold Coast one bedroom in popular hi-rise features air conditioning, large combination living and dining room, newer kitchen with dishwasher, 24 hour doorman, pool, rooftop sun deck, fitness center, heat included and more!!",1,1,0,0,1,Cats OK,no,n,Carpeting,y,In Building,High-rise,yes,yes,1000,Gold Coast,Available: Now,,,,,,,
19396,Rental,Active,Huron & Sangamon,1625,2/21/12,"Gut rehabbed one bedroom loft in River West features central air, heat and expanded digital cable included, new granite/stainless kitchen, stone surround fireplace, rooftop deck, party room, fireplace, skyline views, laundry, parking!",1,1,0,0,1,Cats OK,yes,y,Carpeting,y,In Building,Loft,yes,yes,750,River West,Available: Now,,,,,,,
19397,Rental,Active,Huron & Sangamon,1650,2/21/12,"Newly rehabbed River West one bedroom loft features central air, heat and expanded digital cable included, granite & stainless kitchen, fireplace, rooftop deck with attached party room, fireplace, stunning skyline views, laundry, parking!",1,1,0,0,1,Cats OK,yes,y,Carpeting,y,In Building,Loft,yes,yes,750,River West,Available: Now,,,,,,,
19398,Rental,Active,Huron & Sangamon,1650,2/21/12,"River West one bedroom loft features central air, heat and cable included, new granite/stainless kitchen, stone surround fireplace, rooftop deck with attached party room, fireplace, stunning skyline views, on-site laundry, parking!",1,1,0,0,1,Cats OK,yes,y,Carpeting,y,In Building,Loft,yes,yes,750,River West,Available: Now,,,,,,,
19399,Rental,Active,Huron & Sangamon,2150,2/21/12,"West Town two bedroom oft features central air, granite/stainless kitchen, woodburning fireplace, rooftop deck, stunning skyline views, heat/central air & digital cable included, exercise room, on-site laundry, parking, short walk to Blue Line!",2,1,0,0,1,Cats OK,yes,y,Carpeting,y,In Building,Loft,yes,yes,1100,River West,Available: Now,,,,,,,
19411,Rental,Active,Lincoln Park West & Belden,1015,2/25/12,"Walk to the lake and Lincoln Park Zoo from this newly renovated studio! Hardwood floors, walk-in closets, new kitchen, dishwasher, micro, on-site laundry, Full amenity building with Fitness Center, salon, valet parking, rooftop sundeck, too!",0,1,0,0,1,Cats OK,no,y,Hardwood,y,In Building,Mid-rise,no,yes,300,Lincoln Park,Available: Now,,,,,,,
19412,Rental,Active,Lincoln Park West & Belden,1760,2/25/12,"Junior one bedroom in Lincoln Park!  Hardwood floors, walk-in closets, new kitchen, dishwasher, micro, on-site laundry, Full amenity building with Fitness Center, salon, valet parking, rooftop sundeck, on site cleaners, awesome cafes, too!",0,1,0,0,1,Cats OK,no,y,Hardwood,y,In Building,Mid-rise,no,yes,555,Lincoln Park,Available: Now,,,,,,,
19413,Rental,Active,Lincoln Park West & Belden,1760,2/25/12,"Lincoln Park convertible, just rehabbed!  Hardwood floors, walk-in closets, new kitchen, dishwasher, micro, on-site laundry, Full amenity building with Fitness Center, salon, valet parking, rooftop sundeck, awesome cafes on-site!",0,1,0,0,1,Cats OK,no,y,Hardwood,y,In Building,Mid-rise,no,yes,555,Lincoln Park,Available: Now,,,,,,,
19414,Rental,Active,Lincoln Park West & Belden,1870,2/25/12,"Gorgeous lake/skyline views in Lincoln Park! Hardwood floors, walk-in closets, new kitchen, dishwasher, micro, on-site laundry, Full amenity building with Fitness Center, salon, valet parking, rooftop sundeck, awesome cafes on-site!",0,1,0,0,1,Cats OK,no,y,Hardwood,y,In Building,Mid-rise,no,yes,555,Lincoln Park,Available: Now,,,,,,,
19415,Rental,Active,Lincoln Park West & Belden,1930,2/25/12,"Gorgeous new vintage rehabbed one bed in Lincoln Park! Hardwood floors, walk-in closets, new kitchen, dishwasher, micro, on-site laundry, Full amenity building with Fitness Center, salon, valet parking, rooftop sundeck and more!",1,1,0,0,1,Cats OK,no,y,Hardwood,y,In Building,Mid-rise,no,yes,620,Lincoln Park,Available: Now,,,,,,,
19416,Rental,Active,Lincoln Park West & Belden,1645,2/25/12,"Spacious one bedroom in Lincoln Park across from the lake, park and zoo! Hardwood floors, walk-in closets, new kitchen, dishwasher, micro, on-site laundry, Full amenity building with Fitness Center, salon, valet parking, rooftop deck!",1,1,0,0,1,Cats OK,no,y,Hardwood,y,In Building,Mid-rise,no,yes,620,Lincoln Park,Available: Now,,,,,,,
19417,Rental,Active,Lincoln Park West & Belden,2400,2/25/12,"Huge one bedroom in Lincoln Park across from the lake, park and zoo! Hardwood floors, walk-in closets, new kitchen, dishwasher, micro, on-site laundry, Full amenity building with Fitness Center, salon, valet parking, rooftop deck!",1,1,0,0,1,Cats OK,no,y,Hardwood,y,In Building,Mid-rise,no,yes,900,Lincoln Park,Available: Now,,,,,,,
19418,Rental,Active,Lincoln Park West & Belden,3025,2/25/12,"Gorgeous one bedroom, 1.5 bath in the heart of Lincoln Park! Walk to the beach, park and Zoo! Hardwood floors, walk-in closets, new kitchen, dishwasher, micro, on-site laundry. Fitness Center, salon, valet parking, rooftop deck, restaurants!",1,1,1,0,1,Cats OK,no,y,Hardwood,y,In Unit,Mid-rise,no,yes,1185,Lincoln Park,Available: Now,,,,,,,
19419,Rental,Active,Lincoln Park West & Belden,3995,2/25/12,"Gorgeous two bed, two bath on Lincoln Park West! Walk to the beach, park and Zoo! Hardwood floors, walk-in closets, new kitchen, dishwasher, micro, on-site laundry. Fitness Center, salon, valet parking, rooftop deck, restaurants!",2,2,1,0,1,Cats OK,no,y,Hardwood,y,In Unit,Mid-rise,no,yes,1400,Lincoln Park,Available: Now,,,,,,,
19420,Rental,Active,Lincoln Park West & Belden,3995,2/25/12,"Walk to the beach, park and Zoo! from this gorgeous two bed, two bath on Lincoln Park West! Hardwood floors, walk-in closets, new kitchen, dishwasher, micro, on-site laundry. Fitness Center, salon, valet parking, rooftop deck, restaurants!",2,2,1,0,1,Cats OK,no,y,Hardwood,y,In Unit,Mid-rise,no,yes,1400,Lincoln Park,Available: Now,,,,,,,
19421,Rental,Active,Lincoln Park West & Belden,1650,2/25/12,"Gorgeous new vintage rehabbed one bed in Lincoln Park! Hardwood floors, walk-in closets, new kitchen, dishwasher, micro, on-site laundry, Full amenity building with Fitness Center, salon, valet parking, rooftop sundeck and more!",1,1,0,0,1,Cats OK,no,y,Hardwood,y,In Building,Mid-rise,no,yes,705,Lincoln Park,Available: Now,,,,,,,
19422,Rental,Active,Lincoln Park West & Belden,1465,2/25/12,"Gorgeous new vintage rehabbed one bed in Lincoln Park! Hardwood floors, walk-in closets, new kitchen, dishwasher, micro, on-site laundry, Full amenity building with Fitness Center, salon, valet parking, rooftop sundeck and more!",1,1,0,0,1,Cats OK,no,y,Hardwood,y,In Building,Mid-rise,no,yes,675,Lincoln Park,Available: Now,,,,,,,
19427,Rental,Active,Clark & Adams,5240,2/27/12,"One month free on this Printers Row luxury hirise! Hardwood floors, contemporary granite/stainless kitchen, upgraded bathrooms, over 2000 SF, central air, balcony, fitness center, doorman, garage, pets welcome and more!",3,3,0,1,1,Cats and Dogs OK,no,y,Hardwood,y,In Unit,High-rise,no,yes,2075,Printers Row,Available: Now,,,,,,,
19428,Rental,Active,Clark & Adams,2920,2/27/12,"Drop dead gorgeous Printers Row one bed plus den, 1.5 baths! Hardwood floors, contemporary granite/stainless kitchen, upgraded bathrooms, central air, balcony, fitness center, pool, spa and sauna, doorman, garage, pets OK, dog walk!",1,1,1,1,1,Cats and Dogs OK,no,y,Hardwood,y,In Unit,High-rise,no,yes,1170,Printers Row,Available: Now,,,,,,,
19429,Rental,Active,Clark & Adams,2005,2/27/12,"Beautiful South Loop one bedroom, one bath! Hardwood floors, contemporary granite/stainless kitchen, upgraded bathrooms, central air, balcony, fitness center, pool, spa and sauna, doorman, garage, pets OK, dog walk!",1,1,0,1,1,Cats and Dogs OK,no,y,Hardwood,y,In Unit,High-rise,no,yes,815,Printers Row,Available: Now,,,,,,,
19430,Rental,Active,Clark & Adams,1910,2/27/12,"Spacious, fully upgraded Printers Row one bed, one bath high-rise! Hardwood floors, beautiful granite/stainless kitchen, upgraded bathrooms, central air, balcony, fitness center, pool, spa and sauna, doorman, garage, pets OK, dog walk!",1,1,1,1,1,Cats and Dogs OK,no,y,Hardwood,y,In Unit,High-rise,no,yes,885,Printers Row,Available: Now,,,,,,,
19431,Rental,Active,Clark & Adams,1910,2/27/12,"Beautiful South Loop one bedroom, one bath! Hardwood floors, contemporary granite/stainless kitchen, upgraded bathrooms, central air, balcony, fitness center, pool, spa and sauna, doorman, garage, pets OK, dog walk!",1,1,1,1,1,Cats and Dogs OK,no,y,Hardwood,y,In Unit,High-rise,no,yes,910,Printers Row,Available: Now,,,,,,,
19432,Rental,Active,Clark & Adams,1950,2/27/12,"Stunning, contemporary one  bedroom, den, one bath South Loop full amenity highrise! Hardwood floors, central air, granite/stainless kitchen, balcony, fitness center, pool, spa and sauna, doorman, garage available, pets OK, dog walk!",1,1,1,1,1,Cats and Dogs OK,no,y,Hardwood,y,In Unit,High-rise,no,yes,965,Printers Row,Available: Now,,,,,,,
19433,Rental,Active,Clark & Adams,2750,2/27/12,"All new two bedroom, two bath South Loop highrise! Hardwood floors, contemporary granite/stainless kitchen, upgraded bathrooms, central air, balcony, fitness center, pool, spa and sauna, doorman, garage, pets OK, dog walk!",2,2,0,1,1,Cats and Dogs OK,no,y,Hardwood,y,In Unit,High-rise,no,yes,1195,Printers Row,Available: Now,,,,,,,
19434,Rental,Active,Clark & Adams,2550,2/27/12,"South Loop two bedroom, two bath! Hardwood floors, contemporary granite/stainless kitchen, upgraded bathrooms, central air, balcony, fitness center, pool, spa and sauna, doorman, garage available, pets OK, dog walk for Fido!",2,2,0,1,1,Cats and Dogs OK,no,y,Hardwood,y,In Unit,High-rise,no,yes,1265,Printers Row,Available: Now,,,,,,,
19435,Rental,Active,Clark & Adams,2710,2/27/12,"Stunning, contemporary South Loop two bed, two bath! Hardwood floors, contemporary granite/stainless kitchen, upgraded bathrooms, central air, balcony, fitness center, pool, spa and sauna, doorman, garage, pets OK, dog walk!",2,2,0,1,1,Cats and Dogs OK,no,y,Hardwood,y,In Unit,High-rise,no,yes,1320,Printers Row,Available: Now,,,,,,,
19450,Rental,Active,Burling & Fullerton,2200,3/10/12,"Beautiful three bedroom, one bath vintage rehab in the heart of Lincoln Park! Unit features hardwood floors, new kitchen appliances, original decorative fireplace, on-site laundry, spacious living/dining rooms, parking available, great locale!",3,1,0,0,1,No,yes,n,Hardwood,y,In Building,Walkup,no,yes,1300,Lincoln Park,Available: Now,,,,,,,
19455,Rental,Active,Bryn Mawr & Bernard,825,3/13/12,"Spacious one bedroom, one bath gut rehab near Northeastern University and North Park!  Unit features hardwood floors, central air, updated kitchen and ceramic tile bath, dishwasher, on-site laundry, parking available, cats welcome, too!",1,1,0,0,1,Cats OK,no,n,Hardwood,y,In Building,Walkup,no,yes,750,Rogers Park,Available: Now,,,,,,,
19464,Rental,Active,Ashland & Berwyn,675,4/1/12,"Fantastic studio, one bath in Andersonville mid rise walkup features large combination living and dining room, newer kitchen, newer bath, large bedroom, great closet space, carpeting, laundry, storage and more!!",0,1,0,0,0,Cats OK,no,n,Carpeting,n,In Building,Other,yes,no,800,Andersonville,Available: Now,,,,,,,
19466,Rental,Active,Pine Grove & Grace,1000,5/3/12,"Wrigleyville one bedroom, one bath offers large bedroom, newer bath, good size kitchen, great closet space,  new carpeting, AC unit, laundry, parking available, cat friendly building, and close to public transportation!",1,1,0,0,1,Cats OK,no,n,Carpeting,n,In Building,Condo,no,yes,700,Wrigleyville,Available: Now,,,,,,,
19474,Rental,Active,Beacon & Sunnyside,1500,4/13/12,"Sheridan Park two bedroom, one bath vintage rehabbed walkup features hardwood floors, heat included, updated kitchen, dishwasher, large living/dining rooms, ample closet/storage space, on-site laundry, parking available!",2,1,0,1,1,No,no,n,Hardwood,y,In Building,Walkup,yes,no,1300,Sheridan Park,Available: Now,,,,,,,
19477,Rental,Active,Sheridan & Wellington,895,4/16/12,"Awesome Lakeview studio in a great mid rise features heat/hot water and cooking gas included, new hardwood floors, updated kitchen and bath, ample closet/storage space, spacious living room, dining area , laundry, cats welcome, too!",0,1,0,0,0,Cats OK,no,n,Hardwood,n,In Building,Mid-rise,yes,no,415,Lakeview,Available: Now,,,,,,,
19493,Rental,Active,Wilton & Waveland,1500,4/28/12,"Spacious Wrigleyville one bedroom, one bath condo, fully upgraded! Granite/stainless kitchen, central air, hardwood floors, upgraded bathroom, ample closet/storage space, in-unit laundry, pets welcome, easy street parking, too!",1,1,0,0,0,Cats and Dogs OK,no,y,Hardwood,y,In Unit,Condo,no,yes,800,Wrigleyville,Available: 9/1/2012,,,,,,,
19499,Rental,Active,Palmer & Kedzie,1500,5/2/12,"Delightful Palmer Square two bedroom, one bath features hardwood floors, tall ceilings, updated kitchen, dishwasher, ceramic tile baths, original decorative fireplace, easy parking, and short walk to the Blue Line!  No pets, please!",2,1,0,0,0,No,yes,n,Hardwood,y,In Building,Walkup,no,no,1100,Palmer Square,Available: 10/1/2012,,,,,,,
19500,Rental,Active,Ashland & Berwyn,675,5/3/12,"Fabulous Andersonville studio offers large living space, great closet space,  new kitchen, new bath, heat included, easy street parking, on-site laundry, new carpeting,  cats welcome, close to public transportation and nightlife!",0,1,0,0,0,Cats OK,no,n,Carpeting,n,In Building,Mid-rise,yes,no,500,Andersonville,Available: Now,,,,,,,
19502,Rental,Active,Belmont & Ashland,1750,5/4/12,"Amazing one bedroom, one bath in Lakeview walkup features 1200 square feet, hardwood floors and carpeted bedroom, newer kitchen and bath, in-unit laundry, outdoor deck, parking included, pets welcome, short walk to the EL!",1,1,0,0,1,Cats and Dogs OK,no,y,Hardwood,n,In Unit,Condo,no,yes,1200,Lakeview,Available: Now,,,,,,,
19504,Rental,Active,Carmen & Sheridan,1100,5/5/12,"Spacious Uptown two bedroom, one bath! King size bedroom, heat included, newer kitchen, tile bath, separate dining and living rooms, on-site laundry, short walk to the Lake and the EL, ample closet/storage space, bike storage, cats OK!",2,1,0,0,0,Cats OK,no,n,Hardwood,n,In Building,Walkup,yes,no,1000,Uptown,Available: 9/1/2012,,,,,,,
19509,Rental,Active,Ohio & Noble,1150,5/16/12,"Gut rehabbed one bedroom, den, one bath in hot River West features central air, tall ceilings, hardwood floors throughout, new kitchen, dishwasher, in-unit laundry, deck, easy street parking, minutes to 90/94 and the Blue Line!",1,1,0,0,0,No,no,y,Hardwood,y,In Unit,Walkup,no,yes,900,River West,Available: 8/1/2012,,,,,,,
19510,Rental,Active,Rogers & Ridge,1100,5/18/12,"Upgraded two bedroom, one bath in Rogers Park features granite/stainless kitchen, dishwasher, hardwood floors, ample closest/storage space, in-unit laundry, street parking, convenient to transportation!",2,1,0,0,0,No,no,n,Hardwood,y,In Unit,Walkup,no,yes,1000,Rogers Park,Available: Now,,,,,,,
